title,content,rating,date,author,recommended
"""even Ryanair have more space""","Not Verified | Cabin luggage had to go to cargo, even when I said I carried medicines. There was no time to get them out the hand luggage. The economy seats with Virgin Atlantic, KLM and even Ryanair have more space. Luckily it was a short flight.",3,21st October 2023,M Meijs,
"""in-flight service is usually weak""","✅ Trip Verified |  I have been using BA for a while now and on average I cannot say that I am pretty satisfied. BA somehow experience cancellations and delays most of the time. Second, the in-flight service is usually weak. Food portions are small and cabin crew is not very helpful especially when it comes to drink requests. The screens in the A380s should be renewed as they are full of scratches and same size as A321s. Especially in longer flights, the entertainment system becomes more important. There is also no welcome package except for pillow and small blanket. I would expect more from BA. If you are flying from the US to anywhere except the UK, I would recommend considering other airlines. But if you are flying to/from UK directly, then BA could be one of your choices.",4,21st October 2023,Mehmet Sahiner,
"""BA customer service is a disgrace""","✅ Trip Verified |   I flew from Istanbul to London in Business class. For more than half of the flight a child was watching an iPad very loud with no phones plugged in - it was three rows in front of me and disrupted my flight as I could hear it above my headphones. Staff thought this was fine and refused to tell the mom to turn it down. Why is this acceptable on a flight especially in business class? Has this airline turned into a zoo? Are staff given no training in customer service? Why is a child allowed to disrupt other passengers? When I told the staff she just laughed at me. BA customer service is a disgrace. I've not even mentioned the food but it was bad, really bad.",1,19th October 2023,T Meares,
"""little concern for customer service""","Not Verified |  I have flow on BA several times since the airline started non-stop service between Austin, TX and London Heathrow. Every year the service gets worse. I brought a tape measure with me to see how far apart the seats are in the economy section. 25½ inches. BA has removed bathrooms in order to squeeze a few more rows of seats onto the aircraft. Thankfully I'm not a big person and was able to squeeze into my seat without being too uncomfortable. When BA first started flying out of Austin, the food was great. Now, when I arrive at Heathrow, I get real food and take it on the plane with me. I don't know where or who makes BA's food, but it is not eatable. If BA did not have a direct flight from my hometown to London, I would fly with a different airline. When we checked into Heathrow, the line was extremely long and only one person was checking people in. It took nearly an hour to get to the counter. I understand airlines are making record profits and need to make up lost revenue from the pandemic, but I think BA has gone too far and has little concern for customer service in pursuit of profits.",1,19th October 2023,Mark LaForest,
"""gave up being a full-service airline""","✅ Trip Verified |   The flight departed over an hour late due to a late inbound plane. The plane was very full, and half of the economy class passengers were forced to check in their larger cabin baggage at the gate when boarding, making a complete mockery of the hand luggage allowance advertised. Lots of passengers on board were stressed out about missing onwards connections due to the delays (and some did miss them as their next gates had closed by the time we disembarked at Heathrow). Onboard service was ok but minimal  - BA gave up being a full-service airline some time ago. More concerning is that trying to get hold of customers services to make changes to bookings and deal with problems was non-existent. The airline seems to make it deliberately hard for its customers to contact it.",1,17th October 2023,A Gernal,
“I hate British Airways!”,"✅ Trip Verified |   I hate British Airways! We get to London on Oct 3 and our next flight is cancelled. We stand in line with 1200 other people to get it fixed and they tell everyone to leave the airport and call them to fix. They book us the next day..via online. Don't offer vouchers for hotel, we will miss our tour. Now trying to get home from Istanbul. Plane is here but should have started loading an hour ago. No explanations. May miss next flight. Will never travel with them again. Was this same problem April 2022 flight.",1,17th October 2023,S Carter,
"""2½ hours before the bags finally arrived""","✅ Trip Verified |   Our BA flight from Porto to London Heathrow T5 was operated by Finnair using a Finnair plane and crew. This had been advised by BA shortly after booking, with the option to change flights if we preferred. Although the business class cabin was of a similar layout to BA Club Europe, i.e. with the middle seat kept free, my wife and I felt the seats were more comfortable and the legroom slightly better. Service was good on board and the meal was very tasty (we chose the beef cheeks). All was good until we landed at Heathrow! Although we passed through passport control without delay, once we were at the designated baggage reclaim, we just waited and waited! After an hour and ten minutes I went to the BA baggage counter to ask what was going on. They seemed unaware of an issue, but said they would find out! Over the next hour or so various other passengers also requested information and despite various announcements and a list of different excuses it was almost 2½ hours before the bags finally arrived. Frustrating to say the least. I subsequently complained to BA, but after 4 weeks there has been no explanation just the automated message from customer services ‘we are experiencing exceptionally high volumes’. This response says a lot!",5,16th October 2023,J Horner,
"""left on your own and nobody cares""","✅ Trip Verified | The customer services (call centres etc) are atrocious and sometimes callous. They just don’t care. Long waits to speak to anybody, who then have no power to actually solve anything, and the calls just cut halfway without resolution anyway. If the flights are cancelled (as were my original ones) you’re really left on your own and nobody cares. The onboard services are so-so but for short haul it’s now “semi-low cost” which is confusing as you never know what to expect. This time we were given a bottle of water and a (very) small snack, whilst anything else had to be paid for. And yet on some other flights apparently you have to pre-order any additional food. It’s confusing, which makes it not dependable. Cabin baggage is in theory generous compared to competitors in economy but then they asked more than half the passengers on this flight to check in the cabin baggage at the gate due to lack of space in the overhead cabins, leading to long boarding delays. Their whole offering hasn’t been thought through very well . The USB power supply did not work throughout the flight (contrary to the announcement that the power be available after the seatbelt sight was turned off ) so it was pointless providing the sockets in the first place. Not my first choice airline on this route and am just trying to use up most of my Avios points before I totally abandon them. I fail to see how it is deemed a 4 star airline.",3,14th October 2023,N Anderson,
"""Club Europe is simply a joke""","✅ Trip Verified |   I am a frequent flyer with BA and have been for the last 15 years. Having noted the ratings given, frankly, I cannot understand how BA scores three stars for most aspects of its service. In a nutshell, BA has placed profit margins over passenger appreciation. This fact was hammered home on my return leg, which was not in Club Europe. Quite alarmingly, BA appears to place profit over passenger safety by extending its ""Business Class"" seating up to and beyond emergency exit rows and then failing to ensure those seated in exit rows have the physical capacity to actually open the door incase of an emergency. I was not at all reassured to see an elderly and slightly built woman seated with the responsibility of opening the overwing exit should the need have arisen. Short-haul business (Club Europe) is simply a joke and only useful for gaining valuable tier points for lounge/pre-boarding benefits. While cabin crew service is excellent, the lack of space and reduction in refreshment choices, etc. places them a million 'air'miles behind competing airlines, such as Qatar, Turkish or Emirates who understand the true definition of customer appreciation and hospitality. BA has consistently eroded the value of their Executive Club and seems to be of the impression that recent changes in obtaining avios points during the booking process benefit passengers - really? I want to support BA and did enjoy flying with them up to the point when they started penny pinching and became more deserving of the name ""Budget Airways"" The attached photos taking during my most recent itinerary highlight the difference in customer care/appreciation between British Airways and another airline used in this trip. Both flights were around 4 hours in duration, on the same day. Guess which one is shows BA's in-flight offering!",5,14th October 2023,M Dale,
"""Very second rate shoddy airline""","Not Verified |  Flew with BA to Punta Cana. Took the trouble to reserve seats for both outbound and inbound flights. On boarding at Gatwick, realised we had been moved to much less good seats with other people sitting in the seats we had spent a lot of money reserving. Apparently there has been a change of aircraft and a number of passengers had been automatically reallocated seats for no particular reason. The crew said there was nothing they could do (although of course they could just have swapped us with the couple using our seats). We were told to claim a refund on return home. We did this via a complaint form Ns BA offered us £100 in vouchers. We didn't accept this as it was less than the cost of the seats and also naturally we wanted our money back. We eventually got it but not without a fight. Very second rate shoddy airline.",4,12th October 2023,J Tydeman,
"""some sort of medieval torture""","✅ Trip Verified |   They downgraded me from business to premium economy. They took three months to get back to me and offered me 200 pounds or 400 AUD. The difference between business class and premium economy (which I never fly) is $3000 AUD and the difference between economy and business is $6500 AUD. They owe me at least 1500 pounds and to be very fair 3250 pounds. The downgrade was insulting and incredibly painful as I had a recent cancer operation and have a back injury which I have pointed out to them - I need to lie down. The wait for them to get around to me has been numbing. The insult of their offer has been the slap in the face to continue my degradation. The people I have dealt with at the airport have been down to earth, honest hard working people. The actual staff on the plane were warm and friendly - and helpful. The systems under which BA operates are some sort of medieval torture.",1,12th October 2023,Hugh Kilpatrick,
"""Never again BA""","✅ Trip Verified |   The already delayed aircraft landed and apart from the small BA logo on the rear of the fuselage, there was no indication as to whom the carrier really was. Boarding turned into a farce with passenger groups being told to wait in one queue in order to board, only to be informed we were on the wrong place and our boarding wasn't allowed yet. The interior cabin was reminiscent of a BA cabin from twenty years earlier except the tight legroom and uncomfortable seating which made a budget airline feel luxurious. The crew were not BA but from an unknown charter company. Service was slow, and as usual, choices of food to purchase ran out before they'd reached row 24. I requested a cup of tea which never appeared. Thank goodness for my airport purchased water and the tiny offering of pretzels. The over officious senior flight attendant, who'd been facilitating in 'Club Europe' appeared in economy and immediately slammed down the armrests (whilst still in mid flight) making an already uncomfortable journey feel worse. ""Cattle class"" was definitely that! To say I was happy to land and disembark was an understatement. Never again BA, never again!",1,11th October 2023,Glenn Taylor-Biffen,
"""BA Gatwick are not BA""","✅ Trip Verified |   Caught up in the Gatwick cancellation fiasco; at some point between what was smooth check in (unable to do online as part of group travel) and security, the flight was cancelled; (we were denied entry to security and departures as a result). It was at this point that we discovered BA Gatwick are not BA, but a masquerade, who are unable to help and and provide very little assistance unless the 'real BA' provide information, and even though our baggage was now airside, didn't have a clue as to how we could get it back. It is, however, with thanks to a supervisor from Business Class check in, who came to our assistance and help with our predicament- baggage retrieval, information on what to claim and how, and our revised BA flight from LHR the following evening. (Difficult to give a rating for cabin service as we didn't even board the aircraft)",2,11th October 2023,Glenn Taylor-Biffen,
"""Boarding flight took an hour""","✅ Trip Verified |   BA has a real problem with boarding it's flights. Those who get on first fill the luggage bins with 2 bags, one of which is supposed to be small and under seat only. Cabin staff don't bother implementing their own rules. Subsequent passengers mill up and down the aisle, bumping into each other, searching for space. Boarding this flight took an hour as a result of this nonsense. The incoming flight was late already so our 90 minute flight was 90 minutes late.",1,10th October 2023,S Harten,
"""our luggage was soaking wet""",✅ Trip Verified | Our connecting flight from London to Glasgow was canceled and we were forced to wait 12 hours in the airport for a new flight. When we received our luggage at Glasgow we discovered that our luggage was soaking wet. My wife’s luggage contents were wet and had to be air dried.,1,8th October 2023,Terry Thomason,
"""The worst airline I have ever flown""","✅ Trip Verified |   The worst airline I have ever flown with. Allocated the very back row next to the toilets and galley. No chance of getting any sleep, question asked of possible seat movement ignored and getting bumped the entire time by cabin crew walking or pushing kart up and down aisle without one apology. Would have been better sitting in the luggage compartment.",1,7th October 2023,T Hanson,
"""Excellent service levels""","✅ Trip Verified |   Excellent service levels, proactive crew and superb food and beverages. I found all aspects of the service to be superior to BA business class, even the new BA Club Suites. First Class felt exclusive, the dedicated crew were clearly used to working the premium cabin, enjoying their work, were proactive, friendly, very respectful and the food and beverage offering a considerable step up from business class. The seat, with sliding double doors was spacious, well designed and very comfortable.  British Airways offered a solid First Class service, from Concorde Lounge to boarding (which was actually by group number for a change) to the very warm and genuine welcome on boarding. A consistent, solid, comfortable service from start to finish and if the price was right, I would not hesitate to book First Class with British Airways again.",10,7th October 2023,Peter Costello,
"""British Airways was absolutely shocking""","Not Verified |  Booked a very special holiday for me and my partner, September arrived and we were on our way to lovely South of France, Booked Business Class for us both to start the holiday right. As we were checking I was told the flight was over booked and our seats wouldn't print onto the ticket for some reason. We had already made sure the seats were booked when we had booked the flights nearly a year prior to going. Unfortunately when we arrived at the gate we were then told we would no longer be sat together and one of us would in fact have to go into economy. My girlfriend is an extremely nervous flyer and so had to take extra tablets to remain calm, She didn't have any food which we had pre booked also and she was sat right down the bottom end of the flight. We were held at the gate with another 4 or 5 couples all in the same predicament all due to the lovely money grabbing British Airways over booking the flight. They ended up refusing passengers in the end and even had people sat on the fold down chairs in the toilet area. When we eventually arrived in France late, we was waiting for our luggage to come. Our airtags stated that both our cases was in fact still in Heathrow. We then had to wait 4 days for them to eventually come into France by this point our holiday was ruined. British Airways was absolutely shocking, we couldn't speak to anyone as all the phone numbers were no longer in use. We felt stranded in a foreign country with no clothes and no one to help use with what to do next. Every day we watched them case not moved as we were tracking with air tags. it was so frustrating not being able to plan our days in hope we would get the call to then drive all the way back to the air port 2 hours each way to collect our cases. we ended up going out and buying new clothes toiletries and all the stuff to make the best of our ruined holiday, saving all the receipts thinking we would be able to claim it all back. how wrong I was. British airways take zero responsibility and fob me off with going through my insurance. British Airways only pay for basic essentials, Pants and toothpaste. I filed a complaint when I got back and requested my money back for business class and they haven't even had the decency to even respond. They are an absolute joke of a company and I wish they would remove British out of there name because there is nothing British about them. Do not give them your money, they cant even look after their staff let alone customers. Oh and don't bother trying to cancel your flight either as they just take all of your money off you and give you nothing back.",1,5th October 2023,Kane Kelly,
"""service was mediocre at best""","Not Verified | Just returned from Chicago, flew out 10 days ago on American Airlines absolutely superb in every way, had high expectations on return flight with BA. What a disappointment. The Airbus A380 may be nice from a pilots perspective but as a passenger it was awful. Very uncomfortable seats, the inflight entertainment and flight tracker failed to work throughout the flight, the inflight meal was inedible and the service was mediocre at best. Our short flight from Heathrow to Manchester was much improved, very welcoming and attentive in flight staff and the flight even arrived early. In future we will travel with one of the American carriers.",2,3rd October 2023,Gary Storer,
"""BA standards continue to decline""","✅ Trip Verified |  BA standards continue to decline every time I fly with them. This time, a 45 min late departure, which seems the norm for BA, and no information from the rude and clueless boarding gate staff. The Club lounge was overcrowded, dirty and grubby and cleaning staff could not cope. How many more cutbacks is BA going to apply before they become truly low cost. As a 35 year veteran user of BA, while people complained of Alex Cruz cutting costs, the past 3 years has seen them decline very quickly under their latest CEO. One reads the occasional article about BA improving things, but I have yet to see anything substantive. There seem to be few British staff left amongst the cabin crew, so maybe time for a name change and give the flag carrier status to a proper low-cost - and sadly the staff service has declined year on year. Onboard, the catering remains poor and surprised that Do&Co can produce such rubbish meals when I have sampled their Turkish Airlines equivalent in August that was superb - guessing BA are too tight with their budget. Onboard WiFi service is a joke and should be avoided.",2,2nd October 2023,A Jensen,
"""won the race to the bottom""","Not Verified |  Awful. Business class check in queue just as long as for economy, probably because half of the desks were not staffed and Terminal 5 is chaotic. Business lounge overfull, couldn't get seats. Delayed flight, unmanaged chaos at the gate. No drink on boarding, first drink served an hour after take-off. The meal was poor, used to get better in economy on other airlines. British Airways has won the race to the bottom of the cheapskate stakes. Not looking forward to the flight home.",2,2nd October 2023,John Rockett,
"""Not a reliable airline""","✅ Trip Verified |  Not a reliable airline. You cannot trust the timing at all. I had a 6.45am flight, boarding was on time, but then we are sitting in the plane for already (1.5 hours) and the expected departure is still not clear. They have discovered the engine is not working! I am risking to be late for a business meeting in Geneva. How come they bring a not working plane to the gate. The funny thing is that I had another business trip in spring 2023, also with BA to Amsterdam. When I arrived to the Airport that time - I was told I don't have a seat. I was put on the next flight in several hours, which should have get me to the business meeting late, but still not too much. A lot of stress. In the end, on the second plane we were sitting in the cabin for 1.5 hours and I have missed the meeting. I thought it was a dramatic unlucky case that time, but today I see it's routine for BA not to fly on time.",3,2nd October 2023,Tatiana Bobrovskaya,
"""It is a national disgrace""","✅ Trip Verified |  I take comfort in reading the last ten or so reviews to see I'm not the only traveller to put in words, how absolutely abysmal British Airways are! The only reason we are stuck using this awful airline is to use up points. We booked Club Europe months ago. London to Athens, sat in row 3 and told they had run out of food options, only choice was lentil pie or green curry. Returning Athens to London Club Europe. Couldn't check in online as promised so arrived at the airport 3hrs early. To be told they had overbooked the flight and basically we were being 'bumped' to economy. This airline fails to deliver time and time again. It is a national disgrace and I implore everyone to choose an alternative.",1,30th September 2023,A Dawson,
"""The worst journey in my life""","✅ Trip Verified |  The worst journey in my life. The connection time at LHR was only 1 hour, but the flight from MXP was on delay. I had to rush to change terminal by train and arrived risking a heart attack. After that the plane just stayed there for another 40 minutes. Despite that, upon arrival at SJC my baggage was lost. I filled the form and gave to the employee. I was not given any receipt, so I did not have any reference number. BA phone number at SJC simply never answer. I called twice the toll free number and realized they did not record the delivery address. I had to enter myself online, dealing with a shitty website. They delivered the baggage three days later. I claimed for compensation online, as I had to buy clothes and other stuff and I did never get a receipt. I was expecting an upgrade for the flight back to MXP, but nothing happened, neither they allowed me to enter BA lounge at SJC. Bad customer service. The only positive side was price, but obviously this cannot justify this treatment and if I knew , I would never flown by BA. Never again!",3,30th September 2023,Massimo Garavaglia,
"""Very disappointed""","✅ Trip Verified | The airplanes and the lounges are worn out, old and broken. From Dallas to Heathrow, multiple first class seating and electronics were non functional and poorly designed. The first class seating from Heathrow to Dubrovnik was nothing more than a tray blocking the middle seat of a standard coach ticket. Very disappointed.",4,28th September 2023,Tom Slowbe,
"""the service was shockingly bad""","✅ Trip Verified | One of the worst experiences on the worst airline. The flight was delayed due to earlier technical issues. The time slipped from 17:00 to 20:00 to 22:00 and finally cancelled. There was zero information given. Despite paying well over the odds for business class, we were booted out of the BA lounge two hours before the flight. When it was finally cancelled, the BA staff. Without explanation, told everyone to go to a gate. After another hour or so they made us re enter the UK via passport control, a further 40 minute wait. By now the airport was closing and there was no sign of our bags or any help from BA. A passing Gatwick engineer finally helped us locate the bags. BA completely washed their hands of us and in contravention of CAA rules refused to find us accommodation. Many slept in a bus stop overnight. There were people with young children who couldn’t find somewhere to stay and yet BA had closed down and left. The following day the replacement flight was also late and due to an admin mistake had no catering or liquids for a 2 1/2 hr flight. Overall the service was shockingly bad, the worst I have experienced from any airline. I will not ever use them again.",1,28th September 2023,E Anderson,
