title,content,rating,date,author,recommended
“premium price for a sub-par product”,"✅ Trip Verified |  A premium price for a sub-par product - flew BA (031/032) LHR and HKG and return in May. We had originally booked when the aircraft was allocated the club suites - paid for seat selection. A couple of months prior to the trip, the aircraft was changed to the 2/3/2 layout with the yin/yang seat configuration. We had been allocated 2 of the 3 middle seats, so paid again to select the window and aisle. The hard product is poor - the seat space lacks any form of storage that remains accessible when the seat is in the flat position - nowhere to put specs, a book or phone. Additionally, the window seat passenger has to climb over the feet of another passenger to use the toilet etc - really poor layout. The planes on both legs of the journey were tired and shabby. The crew on the outward journey were enthusiastic and helpful - the return crew seemed less adept at managing the service. The outbound catering was acceptable - but the presentation on tiny plates does not compare favourably with competitors. The catering inbound was very poor. The welcome ‘champagne’ was truly awful. This is a poor product at a premium price - and sad to say, this pair of self-funding passengers won’t choose to repeat the experience. The lounge at Heathrow on the outbound sector was packed to the rafters and was a poor experience. Very disappointing.",3,26th May 2024,L Tomlinson,
"""can't even choose my own seat""",✅ Trip Verified |  Really terrible user experience. British Airways website is full of glitches. I can't even choose my own seat due to cookie problems. Never had this problem with any other airlines.,3,20th May 2024,G Layne,
“Very impressed with BA”,"✅ Trip Verified | Very impressed with BA. Check in online was a little convoluted but once through that everything was great. We flew in standard economy and paid to choose our seats - this seems to be standard for all airlines now and how they keep initial prices down, but worth doing so we could sit together. Meals were excellent and drinks great. A simple water and biscuit on our short internal leg but still included and then 1 drink, 1 main meal and 1 snack on our 7 hour leg was better than our last trip on Emirates!! They gave out double drinks at drink service - that was 2 cokes and 2 beers for my partner and he was well pleased! Staff friendly, bags transfered and arrived in good condition and entertainment on route was good too. Will definitely choose BA again over other airlines.",9,18th May 2024,H Harrison,
"""appalling customer service""","✅ Trip Verified |  LHR - SFO, LAS - LGW August 2023 in Club World. It's a shame that the British Airways experience is split into a mixture of fantastic ground and cabin crew, and dated products and dreadful after service. Our flight to San Francisco was on an A380, the interior of which was showing it's age. Two of our 3 seats had issues, 1 would not recline, the dividing screen to the next seat would not stay up and the other was temperamental with it's recline and the IFE would not respond to the controls. Crew on board were great but the dated and aging product for which top dollar is charged for should have been upgraded years ago. A shame for such a great aircraft. Coming back from Las Vegas to LGW on an tired 777. We were informed at check in that there was an issue with the seats we had pre-booked and paid for and that we would need to be moved. Seats we were moved to were fine and worked. The original seats had people in them and they appeared fine! Flight was late landing and departing due to weather conditions in Vegas but the aircraft was turned round in a super quick time - which was impressive. Where BA have really let themselves down is the after flight experience. After 3 1/2 months we got an acknowledgement and avios credit for the issues on the flight to SFO. We are still waiting 9 months later for the Avios points we used to pay for the seat selection to be refunded for the Las Vegas to London Gatwick leg of the flight. Despite numerous attempts to contact they haven't got back to us. Our Avios account page through BA won't load our recent transactions and does not list the flights we've taken in the last 12 months! Won't be travelling with BA for a long long time now - dated and poorly maintained on board products and appalling customer service.",3,14th May 2024,E Burton,
"""baggage customer service is a joke""",Not Verified |   I flew from Malaga via LHR to Boston on the 4th May 2024 and on arrival in Boston discovered my luggage was still in London. Filed a report and now 4 days later no sign of the luggage. The baggage customer service is a joke. Not interested in the clients or giving a good service. Updates are useless. I know my luggage has been sitting in Boston since the 5th as I have an air tag inside it. The airline seem to have no intention of getting my luggage to me. The robots on FB messenger & twitter are useless. I opened a complaint & when I checked the update of my complaint the case had been closed despite never been contacted by a human!! This airline is now a joke and if I ever get my luggage back I doubt I will ever fly with them again. They are now worse than Air Canada in my book and that is saying something.,2,8th May 2024,Loretta Ahmad,
"""Worst business class ever""","✅ Trip Verified |  Milan to Miami return via London. Worst business class ever. The layout of A380 of BA is crazy. The width of seats is outrageous (aisle seats are a shame for BA). Length is ok but you have to JUMP over the legs of another passenger when he/she is in sleeping mode. Unbelievable. The system of dividers up and down to reach all seats by crew is absurd and awful. Never again with this layout. Meal was below average from LHR to Mia, while the return was quite good. Unfortunately for BA, I flew in March with Qatar Airways business class, and not comparable. Just to highlight the difference: BA row has 8 seats, while QR has 4 seats! That’s it. On top of that, the service is quite strange (mainly due to dividers above). Boarding procedures look well organized at the beginning, then during boarding become quite messy.",1,8th May 2024,R Bartelo,
"""replicating the likes of Ryanair""","✅ Trip Verified |  BA created a new low-cost subsidiary in BA Euroflyer for flights out of London Gatwick. From a passenger point of view this is meant to mean no difference in service from BA mainline short-haul out of Heathrow. However it is most definitely inferior. Firstly is the seats - BA promised to keep their old much more comfortable Pinnacle seats up to row 12 in their refurbishment of these planes with slimline seats, however at BA Euroflyer it seems the whole plane has these installed on some planes. Despite snagging a seat in row 10, we ended up still with those horrible back breaking seats that have no lumbar support and no headrests. One positive of the new seats was meant to be at-seat power to charge devices, but this didn't have that either. The onboard service is meant to include some complimentary food and drink, namely a sweet or savoury snack and a small bottle of Harrogate Spa water. What we got was horrible Nairn's Raisin Oat biscuits, without asking if we'd like the other choice and no water. On the return flight it was explicitly announced we'd be offered a glass of water for free, but this was not offered during the service. The snack was sole choice of a pack of McVities Milk Chocolate digestive, hardly premium and downgrade from some of the more alternative and upmarket offerings we've received when flying from Heathrow. On the way back we did have non-refurbished plane with pinnacle seats, this was welcome, however clearly the plane is not maintained, as one toilet had no water flowing from the tap - very irritating when you soap up to wash your hands after going to the toilet. I went to rinse my hand in the other toilet, luckily it wasn't busy, the tap was working but the sink wasn't draining and almost overflowed. Lastly the cabin crew on BA Euroflyer are very unpolished, look miserable and extremely demotivated. A lot of them a very young, we're talking late teens and clearly very inexperienced and not likely to stay long under the conditions offered to them. BA really needs to rethink its product offering in short-haul - ultimately people choose to fly with them for variety of reasons, but invariably there is a reason like us they don't fly with their low-cost rivals because they want peace of mind, less stress and to be comfortable. So replicating the likes of Ryanair, easyJet or Wizz Air is just alienating as a customer, because we choose BA to avoid the kind of experience they offer. We were on an award ticket, but looking at cash tickets they're not even cheap nor offer better timings than those rivals, despite all this bean-counting!",4,7th May 2024,A Ahmed,
"""declined to offer compensation""","✅ Trip Verified |   I flew with British Airways from Heathrow to Hannover. Although the check-in process was relatively quick, there was a noticeable lack of staff—another apparent cost-cutting measure by BA. Upon arriving in Hannover, I found that my luggage hadn't made it to the airport, and there were no staff to assist. I had to file a report online. The following day, I received a call saying my luggage would arrive on a later flight, but this didn't help me since German shops are closed on Sundays, leaving me without essential items. As a result, I was confined to my hotel, unable to attend any planned events because I didn't have suitable clothing. When my luggage eventually reached the Hannover airport, I got a call from BA informing me that they couldn't deliver it for another day or two. They advised me to take a taxi to pick it up and said I could claim back the cost, but when I submitted my claim, BA refused to cover the taxi expenses. They also declined to offer compensation for the inconvenience caused by the delayed baggage, even though it disrupted a full day of my trip. Service on my return flight from Frankfurt was also below par from the ground crew at Frankfurt airport who were slow & rude at check in. BA's customer service has declined significantly, now resembling the level of budget airlines like EasyJet and Ryanair—but at a premium price. Given my recent experience, I will avoid flying with BA whenever possible.",2,5th May 2024,N Wilson,
"""onboard like discount carriers""","✅ Trip Verified |  Manchester to Copenhagen via London on 30th April 2024 Aircrafts were A319 and A320, respectively, both in decent condition. I arrived from Africa, and had to transit and change terminal to T3, which is very cumbersome and tedious. Check-in was quick, easy, and professional, got my desired seats due to silver status at BA. From T3 I had to go through one of the worst security checks ever encountered, fragmenting almost every item in my carry-ons. Their Escape Lounge in T3 is quite decent, particular beer choices and prosecco sparkling wine. Food was very poor, neither any savoury snacks nor meaty food at all. Good tarmac view. First flight was delayed, forcing me to catch the 2nd in LHR within ½ hour. However, I was informed clearly at gate upon arriving in LHR, assisting me on next gate and the airline managed to transfer the luggage in this extremely narrow timeslot. Onboard, only a mini-bottle of water and some bagged crumbs were given, fairly useless and superfluous. No IFE or WiFi. Annoying charity beggings from FAs on both flights are intrusive, annoying, disrespectful, and degrades the airline. Offerings onboard like discount carriers, except being pricier. Arrived final destination on time and so did my luggage.",6,1st May 2024,Anders Pedersen,
"""Never using them again""",✅ Trip Verified |  I have never seen such disrespect to a customer. It was the 3rd time in 2 months that I was unable to do a check-in because of their website not working properly. Lost 2 hours on the phone with their customer service team. At the airport I was asked to check in my hand luggage because they had no more space in the cabin. I could not recline my seat and the staff was rude and unhelpful to me. The wifi was also not working. I made multiple complaints and no one ever even contacted me. Never using them again!,1,30th April 2024,E Lartreanu,
"""undiscerning and insincere compensation""","✅ Trip Verified |  Paid for a 14 hour long flight ticket which includes use of the in-flight entertainment system. Ended up in a seat where the in-flight entertainment system was malfunctioning and could not be used at all. Flight attendants sought to perform a ""service recovery"" through their customer relations team. Contacted by the said team slightly more than a week later with an offer of an eVoucher that can only be used in purchasing additional flight tickets with BA. Explained to them that I had no intentions of travelling again within the next two years so I had no use of an eVoucher and sought for an alternative form of compensation instead, something that could really be useful instead. Customer Relations simply brushed my request off as them unable to offer any alternate ""gesture of goodwill"".  Compensation in British Airways is a matter of ""goodwill"". Pay for a ticket but don't get what you paid for in full. Compensation is one that requires you to spend even more money on the airline (so that they can disappoint you further). An ultimately self-serving, inconsiderate, undiscerning and insincere compensation. Which in itself isn't even anything they feel guilty or remorseful about, because any compensation is a ""gesture of goodwill"", something you don't deserve in their view.",1,27th April 2024,Ezra Tan,
"""mock and insult your passengers""","✅ Trip Verified |  Very inconsiderate PA announcements were made by a purser who appearingly decided to exchange his career at BA for comedy club acting, although not at the right setting. First pre-landing PA: “My colleague and I had a very long week with British Airways, so we are dimming the lights as we don’t want you to see our faces. If you are afraid of the dark - just look at the passenger next to you”. Although clearly not the purser’s intent, it sounded like a mocking and very careless of people with aero / darkness phobias who may have a panic attack after such a joke. Very inconsiderate and damages BA’s brand as a safe, accessible and a trusted airline. Second PA after landing was: “if you’d like to make a complaint, go call EasyJet”. I felt genuinely insulted by this “joke”. BA charged an abusive fee. In the end, I literally had to beg the rude and dismissive ground staff in Madrid not to check my roller bag at gate because I recently had surgery and needed to hold onto it to walk. Instant noodles which I purchased onboard were barely edible. All cabin crew except from one disappeared at the galley where they were loudly chatting and laughing and looked at me as a nuisance even when I just wanted to pass through them to visit the lavatory. And then the chief purser effectively announces that if anyone is unhappy they can go fly someone else. Wake up, BA! You are already worse than EasyJet and Ryanair in terms of value for money!! I note that only ones who found the purser’s jokes funny were the other cabin crew who made a few vulgar laughs, while passengers remained dead silent. I can understand airlines scaling back services to cut costs. I will never understand how you can allow your staff to openly mock and insult your passengers. I am a BA Silver member and have been a loyal BA customer for years. A disgrace.",1,25th April 2024,G Reyes,
"""lost my luggage on both flights""","✅ Trip Verified |  Absolutely terrible, lost my luggage on both flights, delivered 3 days later smashed to pieces. A lete departure caused me to miss the connecting flight, yielding a 7 hour delay. the aircraft was oversubscribed, dirty, with an unpleasant persistent odour. Food was genuinely horrible, I'm ex forces, I'll eat almost anything usually!",1,22nd April 2024,David Wright,
"""the worst experience""","✅ Trip Verified |  We booked premium economy round trip from Phoenix to Zurich via AA codeshare and operated by British Airway. On our way return flight back to Phoenix February 25th, the first leg of the BA flight 0773 between Zurich and London Heathrow was delayed departure, which cause us missed the BA 0289 connection flight between Heathrow and Phoenix. First problem is that when we dash to the terminal 5 security check point at 12:00 PM, the airplane was still at gate and will not depart until 2:25 PM if it will be on schedule, we had almost 30 min at that point, however the terminal 5 security stopped us and was told we cannot pass thru the security due to airline requirement, we later realized that flight 0289 did not leave until 3:30 PM. We were directed to the customer service to re-book the flight. When we got to BA customer service transfer counter, there was only one agent available, there were least 12 passengers waiting in the lines, we were told BA was short of staffs due to British holiday during end of February and there was a soccer championship match that Sunday, so it took us at least an hour and half to rebook the same flight next day, also it seems there are not much option at all if we want to back to Phoenix on different flight on the same day. Then, the agent who re-booked the flight told us his printer was broken and we need go to Zone 2 of terminal 5 to get the ticket and hotel voucher printed. We found Zone 2 and had our ticket and voucher in hand and assure by the agent that our luggage will be on our next day flight with us as well. We also told there was a shuttle bus around the corner to take us to the hotel, however no map or detail direction provided, it took us a while to find out that the shuttle is at back side of the terminal 5, by the time we arrived at hotel we were very tired. Next day, we arrived at airport few hours ahead our scheduled departed time 2:25 PM, I noticed my checked two bags not in the same spot based on my iPhone’s Find me feature (I had Apple Air Tag in each of my checked bags), so I checked with the gate agent, she confirmed with me that only one checked bag was associated with my flight! Luckily, the flight was delayed two hours, so my other bag made to the same flight. While on the flight, the team of young flight attendants were generally pleasant, but they missed to service me meal, I did not order any special meal, and the popular chicken dish was not available when she came to my row, so I told her any chicken dish will be ok, and she told me give her few minutes and she will bring me a different chicken dish, however she totally forgot that and only when she came back to collect the trash, I mentioned to her she forgot my chicken dish, she was surprised and acting like I was lying to her. Overall, I think my premium economy flight on BA is the worst experience in recent memory. As the British flagship carrier, they seem don't care, I emailed my sent my experience to their customer service, they responded with a standard corporate reply from one of their email templates...",1,20th April 2024,G Han,
"""The flights were okay""","✅ Trip Verified |  We chose Rotterdam and London City airport because of convenience, both small and having a hotel in the Docklands meant a short distance from City Airport. Three hours before our departure our flight was canceled however. Disappointing, but we made a swift move to Amsterdam Schiphol Airport, but unfortunately we were offered a flight to Heathrow, which meant almost 1,5 hours by tube to our hotel. Flight back operated out of LCY to RTM, but had a 30 mins delay, so in terms of punctuality BA is not very reliant. The flights were okay, with a snack and a drink. The E190 being far more comfortable with 2-2 seating and more legroom than the A319. Our extra expenses for the cancelled flight were handled promptly and we got all the money for extra transport and food back, so BA did a good job in this respect. But hesitant to book again, though they are the only airline flying between RTM and LCY.",6,12th April 2024,Eelco van den Heuvel,
“entire experience has been stressful”,"✅ Trip Verified | The entire booking and ticketing experience has been stressful and erroneous. I booked directly with BA as I thought - why go to any other airline when their home headquarters is UK and I need to go to the UK. Mistake. This was months ago. I could not cancel or change my flight without paying them $750 to cancel my flight and have that money sitting for just 1 year on account, otherwise all was lost minus a few hundred in taxes. As whom I am really flying with is American Airlines and another partner I can't check in without being redirected. Then those sites don't recognize me. I don't appear in AA or Aer Lingus applications. I couldn't ask for more time to change planes in London despite all reviews saying how long and hard it is, as that would mean a cancel of plane ticket - loss of all money. I've been on the phone with agents for over an hour on 3 different calls. Their app will not let me in without each time a reset of passcode, a 30 minute wait for the email and then I get the same error.",1,10th April 2024,J Davidson,
"""whole experience was awful""",Not Verified |   British Airways cancelled my flight less than 24 hours before. Automatically rebooked it for 2 days later. I called customer service 3 times trying to change it and they would Not help. My daughter was flying on a different reservation and because I am legally blind I needed to be on the same flight - they didn’t care nor would they help. We eventually bought new tickets on easyJet. When we arrive home I entered a complaint to get my fare refunded. It took them 4 months and then the response was it was cancelled because of a strike in Spain so they won’t refund it. EasyJet didn’t cancel. The whole experience was awful and so disappointing.,1,10th April 2024,Jacki Dioguardi,
“This is true service”,"Not Verified | I wanted to write this review so I could give a huge thank you to one of the staff on Lisbon named Jay Ramphul. She went above and beyond and really helped me in an urgent situation. I had boarded my flight with 20 minutes before take off when I realized I had left my cell phone in the club lounge. I was not going to get permission to deboard and get back on in time for take off. Jay stepped in and made it happened. She literally ran with me a far distance to retrieve my phone with me and get me back on the plane within minutes of take off. This is true service! I don't know if this review will ever get back to her or her management, but I hope it does. I want to again express my gratitude for her help and kindness in this matter.",10,7th April 2024,Enrica H Price,
"""Flight attendants welcoming""","✅ Trip Verified |  Check in fast and friendly. Security a breeze. Lounge was busy early evening but comfortable and clean. Flight attendants welcoming. Seat a nightmare it was the reverse/forward with a step over from the window seat, who the hell thought that was a good idea?? Meal were OK but all curry based, like curry and I was on a flight to India so. FA was brilliant as the only flyer awake on an overnight flight. Improving since my last BA flight",7,3rd April 2024,Mike Flynn,
"""the service was appalling""","✅ Trip Verified |  This is the first time I have seen the new Club World suite. The seat was comfortable but unlike other airlines, BA has crammed as many seats in business class as is humanly possible so the cabin felt cramped. The crew behaved as though we, the passengers, should have been grateful for them turning up for their shift. They looked scruffy in the new uniforms, clearly the dress code policy has been scrapped. I appreciate that appearance is no measure of service quality (in the UK alone) but the service was appalling. The menu lacked choice and the food was presented as if it fell to the floor and was scooped back onto the plate. The bedding was atrocious, an old scraggly blanket and I’ll fitting seat cover. I was cold and asked for an extra blanket which never arrived. There were no drinks coasters (obviously cutbacks) so my drinks kept spilling. I decided to clean up myself as the crew couldn’t be bothered and didn’t pick up on the fact I was using bathroom hand towels to act as drinks coasters to mop up the mess. The aircraft was old (although retrofitted) and had a leak by the galley wall with lots of blue roll in situ to mop up the mess. Not at all a premium service, this felt more like a low cost carrier doing “business”.",3,2nd April 2024,E Dodson,
"""service was slow and unfriendly""","✅ Trip Verified |  Flew business class from Doha to London on 31st March. The service was slow and unfriendly, even one of the male cabin crew working in business class asked the female cabin crew who was looking after the area where I was in to smile. I ordered waffles for breakfast and they looked like they’d fallen off the plate and had been thrown back on (see photo). The plate that the waffles were served on was so hot that when I moved the plate I burnt my finger. I wasn’t warned that it was ferociously hot. I was shocked at how bad the food presentation was, but didn’t feel comfortable saying anything to the cabin crew as she wasn’t approachable or friendly. For lunch, the bread roll was so dry and rock hard that I couldn’t cut through the ends. Not sure why the food and service was so bad on this flight as generally BA food is good and is well presented. Also, the Wi-Fi wasn’t working on the flight.",4,2nd April 2024,David Williams,
